<?xml version="1.0" encoding="UTF-8"?>
<!--DTD generated by XML Spy v3.5 (http://www.xmlspy.com)-->
<!-- DTD for PAWS Starter Kit XML to HTML and code mappers -->
<!ENTITY nbsp "&#160;">
<!ENTITY % embedded "#PCDATA | br | category | contents | example | feature |
						 featureChart | file | help | i | ol | p | section | span |
			 template | templateName | tool | tree | u | ul">
<!ELEMENT br EMPTY>
<!ELEMENT button EMPTY>
<!ATTLIST button
	id ID #REQUIRED
	value (Cancel | OK | Yes | No) #REQUIRED
	goto CDATA #IMPLIED
>
<!ELEMENT buttons (button, codeInfo?, ruleInfo?, button, codeInfo?, ruleInfo?)>
<!ELEMENT category (#PCDATA)>
<!ELEMENT codeInfo (#PCDATA)>
<!ELEMENT contents (#PCDATA)>
<!ELEMENT EnglishExample (exItem+)>
<!ELEMENT example (#PCDATA)>
<!ELEMENT exItem (#PCDATA | u)*>
<!ATTLIST exItem
	label CDATA #IMPLIED
>
<!ELEMENT feature (#PCDATA)>
<!ELEMENT featureChart (featureRow)+>
<!ATTLIST featureChart
	types (yes | no) "yes"
	explanations (yes | no) "yes"
>
<!ELEMENT featureExplanation (#PCDATA)>
<!ELEMENT featureItem (#PCDATA)>
<!ELEMENT featureRow (featureType, featureItem, featureExplanation)+>
<!ELEMENT featureType (#PCDATA)>
<!ELEMENT file (#PCDATA)>
<!ATTLIST file
	id ID #REQUIRED
	section CDATA #REQUIRED
>
<!ELEMENT form ((textBox | prompt | radioGroup | instruction | codeInfo | ruleInfo | introduction | EnglishExample)*, br?, buttons)>
<!ATTLIST form
	transparent (yes | no) "no"
	section CDATA #REQUIRED
>
<!ELEMENT help (#PCDATA)>
<!ATTLIST help
	href CDATA #REQUIRED
>
<!ELEMENT i (#PCDATA)>
<!ELEMENT groupName (#PCDATA)>
<!ATTLIST groupName
	dataItem CDATA #REQUIRED
	default CDATA #REQUIRED
	position (no | yesSpec | yesHead | yesHeadDiff) "no"
>
<!ELEMENT instruction (%embedded; | codeInfo | ruleInfo)*>
<!ATTLIST instruction
	id ID #IMPLIED
>
<!ELEMENT introduction (%embedded; | codeInfo | ruleInfo)*>
<!ELEMENT li (%embedded;)*>
<!ATTLIST li
	id ID #IMPLIED
>
<!ELEMENT ol (li+)>
<!ELEMENT p (%embedded;)*>
<!ATTLIST p
	style CDATA #IMPLIED
>
<!ELEMENT page (title, (introduction | EnglishExample | instruction)*, form)>
<!ELEMENT prompt (#PCDATA | category | i | span)*>
<!ATTLIST prompt
	id ID #IMPLIED
>
<!ELEMENT radio (%embedded;)*>
<!ATTLIST radio
	id ID #REQUIRED
	dataValue CDATA #REQUIRED
	checked (yes) #IMPLIED
>
<!ELEMENT radioGroup (groupName, prompt, radio, (radio | codeInfo | ruleInfo | radioGroup)*)>
<!ATTLIST radioGroup
	id ID #IMPLIED
>
<!ELEMENT ruleInfo (#PCDATA)>
<!ELEMENT span (%embedded;)*>
<!ATTLIST span
	id ID #IMPLIED
>
<!ELEMENT section (#PCDATA)>
<!ATTLIST section
	number CDATA #REQUIRED
>
<!ELEMENT textBox EMPTY>
<!ATTLIST textBox
	id ID #REQUIRED
	contenteditable (true | inherit | false) "inherit"
	dataItem CDATA #REQUIRED
	rows CDATA #IMPLIED
	cols CDATA #IMPLIED
>
<!ELEMENT title (#PCDATA | i)*>
<!ATTLIST title
	level CDATA #IMPLIED
>
<!ELEMENT template (#PCDATA)>
<!ELEMENT templateName (#PCDATA)>
<!ELEMENT tool (#PCDATA)>
<!ELEMENT tree (#PCDATA | br)*>
<!ELEMENT u (#PCDATA)>
<!ELEMENT ul (li+)>
