<?xml version="1.0" encoding="UTF-8"?>
<!DOCTYPE page SYSTEM "C:\FieldWorks\ww\ww\PAWS\Data\PAWSSKHtmlMapper.dtd">
<?xml-stylesheet type="text/xsl" href="C:\FieldWorks\ww\ww\PAWS\Templates\PAWSSKHtmlMapper.xsl"?>
<page>
	<title level="2">Basic, Single-Clause Sentences - Agreement Features</title>
<instruction>Verbs and auxiliaries may also carry agreement features that force agreement with the subject, and sometimes also with the direct object.  Key the appropriate features on the relevant affixes.  In the case of animacy, this is most likely not an affix but a property of the individual verbâ€™s semantics whether its subject and/or object must be animate, so those features will need to be keyed on the verb entry.
<featureChart>
<featureRow>
<featureType>person</featureType>
<featureItem>first_subjectfirst_object</featureItem>
<featureExplanation>the subject must be first personthe object must be first person</featureExplanation>
</featureRow>
<featureRow>
<featureType/>
<featureItem>first_exclusive_subjectfirst_exclusive_object</featureItem>
<featureExplanation>the subject must be first person exclusivethe object must be first person exclusive</featureExplanation>
</featureRow>
<featureRow>
<featureType/>
<featureItem>first_inclusive_subjectfirst_inclusive_object</featureItem>
<featureExplanation>the subject must be first person inclusivethe object must be first person inclusive</featureExplanation>
</featureRow>
<featureRow>
<featureType/>
<featureItem>second_subjectsecond_object</featureItem>
<featureExplanation>the subject must be second personthe object must be second person</featureExplanation>
</featureRow>
<featureRow>
<featureType/>
<featureItem>third_subjectthird_object</featureItem>
<featureExplanation>the subject must be third personthe object must be third person</featureExplanation>
</featureRow>
<featureRow>
<featureType>number</featureType>
<featureItem>singular_subjectsingular_object</featureItem>
<featureExplanation>the subject must be singularthe object must be singular</featureExplanation>
</featureRow>
<featureRow>
<featureType/>
<featureItem>dual_subjectdual_object</featureItem>
<featureExplanation>the subject must be dualthe object must be dual</featureExplanation>
</featureRow>
<featureRow>
<featureType/>
<featureItem>plural_subjectplural_object</featureItem>
<featureExplanation>the subject must be pluralthe object must be plural</featureExplanation>
</featureRow>
<featureRow>
<featureType>gender</featureType>
<featureItem>masculine_subjectmasculine_object</featureItem>
<featureExplanation>the subject must be masculinethe object must be masculine</featureExplanation>
</featureRow>
<featureRow>
<featureType/>
<featureItem>feminine_subjectfeminine_object</featureItem>
<featureExplanation>the subject must be femininethe object must be feminine</featureExplanation>
</featureRow>
<featureRow>
<featureType/>
<featureItem>neuter_subjectneuter_object</featureItem>
<featureExplanation>the subject must be neuterthe object must be neuter</featureExplanation>
</featureRow>
<featureRow>
<featureType>animacy</featureType>
<featureItem>animate_subjectanimate_object</featureItem>
<featureExplanation>the subject must be animatethe object must be animate</featureExplanation>
</featureRow>
<featureRow>
<featureType/>
<featureItem>-animate_subject-animate_object</featureItem>
<featureExplanation>the subject must be inanimatethe object must be inanimate</featureExplanation>
</featureRow>
<featureRow>
<featureType>class</featureType>
<featureItem>class_##_subjectclass_##_object</featureItem>
<featureExplanation>(replace ## with the class number up to 99)</featureExplanation>
</featureRow>
</featureChart>

</instruction>
	<form section="ip" transparent="yes">
		<buttons>
			<button id="IPAgrFeaturesOK" value="OK" goto="IPContents.htm"/>
			<button id="IPAgrFeaturesCancel" value="Cancel"/>
		</buttons>
	</form>
</page>
