<!DOCTYPE page SYSTEM "C:\FieldWorks\ww\ww\PAWS\Data\PAWSSKHtmlMapper.dtd">
<?xml-stylesheet type="text/xsl" href="C:\FieldWorks\ww\ww\PAWS\Templates\PAWSSKHtmlMapper.xsl"?>
<?xml-stylesheet type="text/xsl" href="C:\FieldWorks\ww\ww\PAWS\Templates\PAWSSKCodeMapper.xsl"?>
<page>
  <title level="2">Quantifiers and QP - Degree Words (Part 2)</title>
  <form>
	<prompt>Key your examples containing degree words here:</prompt>
	<textBox id="QPDegreeExample"/>
	<radioGroup>
	  <groupName>RDegree</groupName>
	  <prompt>Based on these examples, where do the degree words occur with respect to the quantifier?</prompt>
	  <radio id="QPDegreeBefore" checked="yes">Before the quantifier</radio>
	  <ruleInfo>Before is QP Option 2.</ruleInfo>
	  <codeInfo>Before is Spec-initial default and Spec-internal default.</codeInfo>
	  <radio id="QPDegreeAfter">After the quantifier</radio>
	  <ruleInfo>After is QP Option 3.</ruleInfo>
	  <codeInfo>After is Spec-final default.</codeInfo>
	  <radio id="QPDegreeEitherSide">On either side of the quantifier</radio>
	  <ruleInfo>Either is QP Option 4 (no matter what the answer is to next question).</ruleInfo>
	  <codeInfo>Following is greyed out unless the either button is checked</codeInfo>
	  <radioGroup id="QPDegreeEitherSideTable">
		<groupName>RDegreeEitherSide</groupName>
		<prompt>Can all the degree words appear on either side of the quantifier?</prompt>
		<radio id="QPDegreeEitherYes" checked="yes">Yes, there is no restriction</radio>
		<radio id="QPDegreeEitherNo">No, there are separate sets for each side</radio>
		<codeInfo>End of greyed out section</codeInfo>
	  </radioGroup>
	</radioGroup>
	<instruction>In the lexicon, mark this type of quantifier
with the feature <feature>Q</feature>.  This will change
their category to <category>Q</category> for the syntax.  If a particular quantifier can
only go with plural nouns, add the feature <feature>plural</feature> to that entry.  Also, mark any words
which can modify them with the features <feature>Deg
modifies_Q</feature>.<codeInfo>For the No answer to either side:</codeInfo>
	  <span id="QPDegreeEitherNoInstruction">Those which can only occur before the quantifier
also need to have the feature <feature>QP-initial</feature>
and those which can only occur after the quantifier also need the
feature <feature>QP-final</feature>.  Do not enter either
feature <feature>QP-initial</feature> or <feature>QP-final</feature> on any degree words which can occur on
either side.</span>
	  <codeInfo>end of For the No answer to either side:</codeInfo>Note that these degree words will most likely not be the
same as the ones which can modify an NP above.</instruction>
	<buttons>
	  <button id="QPDegree2OK" value="OK" goto="QPCardinal.htm"/>
	  <button id="QPDegree2Cancel" value="Cancel"/>
	</buttons>
  </form>
</page>
