<?xml version="1.0" encoding="UTF-8"?>
<!DOCTYPE page SYSTEM "..\Data\PAWSSKHtmlMapper.dtd">
<?xml-stylesheet type="text/xsl" href="..\Templates\PAWSSKHtmlMapper.xsl"?>
<page id="NPNounCase">
	<title level="2">Nominal Phrase - Noun Case</title>
	<form section="np">
		<radioGroup>
			<groupName dataItem="nounCase" default="no">RNPCase</groupName>
			<prompt>Is case morphologically marked on nouns?</prompt>
			<radio id="NPCaseNo" dataValue="no">No, case is not marked at all, or only marked on the pronouns</radio>
			<radio id="NPCaseYes" dataValue="yes">Yes</radio>
			<radioGroup id="NPCaseYesTable">
				<groupName dataItem="nounCaseType" default="nomAcc">RNPCaseType</groupName>
				<prompt>Which system of case marking is used?</prompt>
				<radio id="NPCaseTypeNomAcc" dataValue="nomAcc">Nominative-accusative (where all subjects are nominative case and direct objects are accusative case)</radio>
				<radio id="NPCaseTypeErg" dataValue="erg">Ergative-absolutive (where subjects of transitive verbs are ergative case and subjects of intransitive verbs and objects of transitive verbs are absolutive case)</radio>
			</radioGroup>
		</radioGroup>
		<instruction id="NPCaseTypeNomAccInstruction">In the lexicon, mark the affix(es) that label nominative case with the feature <feature>nominative</feature>, along with any other agreement features they also mark.  Add the feature <feature>accusative</feature> to the affixes that mark accusative case.</instruction>
		<instruction id="NPCaseTypeErgInstruction">In the lexicon, mark the affix(es) that label ergative case with the feature <feature>ergative</feature>, along with any other agreement features they also mark.  Add the feature <feature>absolutive</feature> to the affixes that mark absolutive case.</instruction>
		<buttons>
			<button id="NPCaseBack" value="Back" goto="NPContents.htm"/>
			<button id="NPCaseNext" value="Next" goto="NPContents.htm"/>
		</buttons>
	</form>
</page>
